{
  "$ref": "#/definitions/experience",
  "definitions": {
    "experience": {
      "type": "object",
      "properties": {
        "company": {
          "type": "string"
        },
        "role": {
          "type": "string"
        },
        "startDate": {
          "type": "string"
        },
        "endDate": {
          "type": [
            "string",
            "null"
          ]
        },
        "location": {
          "type": "string"
        },
        "technologies": {
          "type": "array",
          "items": {
            "type": "string"
          },
          "default": []
        },
        "achievements": {
          "type": "array",
          "items": {
            "type": "string"
          },
          "default": []
        },
        "link": {
          "type": "string",
          "format": "uri"
        },
        "order": {
          "type": "number"
        },
        "$schema": {
          "type": "string"
        }
      },
      "required": [
        "company",
        "role",
        "startDate",
        "location",
        "order"
      ],
      "additionalProperties": false
    }
  },
  "$schema": "http://json-schema.org/draft-07/schema#"
}