{
  "company": "TODO: Previous Company",
  "role": "Software Engineer Intern",
  "startDate": "2022-06",
  "endDate": "2022-12",
  "location": "Remote · India",
  "technologies": ["Python", "FastAPI", "PostgreSQL"],
  "achievements": [
    "TODO: Replace with a real measurable achievement.",
    "TODO: Shipped X feature used by Y users."
  ],
  "order": 2
}
