{
  "company": "TODO: Company Name",
  "role": "Software Engineer",
  "startDate": "2023-06",
  "endDate": null,
  "location": "Remote · India",
  "technologies": ["TypeScript", "React", "Node.js", "AWS"],
  "achievements": [
    "TODO: Replace with a real measurable achievement.",
    "TODO: Add another achievement with impact and scale."
  ],
  "link": "https://example.com",
  "order": 1
}
